{
  "case_id": "v5_dx8aGSIo24w_39-69",
  "episode": "dx8aGSIo24w",
  "segment": [
    39,
    69
  ],
  "label_source": "dx8aGSIo24w:Q04",
  "label_kind": "demonstrator_induced",
  "expected": [
    "N-P_DX8AGSIO24W",
    "N-C_DX8AGSIO24W_C01"
  ],
  "facts_path": "../facts/dx8aGSIo24w_39-69_facts.json"
}
