{
  "case_id": "v7_2Nn9tyMECZU_440-470",
  "episode": "2Nn9tyMECZU",
  "segment": [
    440,
    470
  ],
  "label_source": "2Nn9tyMECZU:Q14",
  "label_kind": "demonstrator_induced",
  "expected": [
    "N-C_2NN9TYMECZU_C02",
    "N-C_2NN9TYMECZU_C03",
    "N-C_2NN9TYMECZU_C04"
  ],
  "facts_path": "../facts/2Nn9tyMECZU_440-470_facts.json"
}
