{
  "case_id": "v5_Am8j1Zw5KrE_70-100",
  "episode": "Am8j1Zw5KrE",
  "segment": [
    70,
    100
  ],
  "label_source": "Am8j1Zw5KrE:Q04",
  "label_kind": "demonstrator_induced",
  "expected": [
    "N-P_HNVBBPEOB3G",
    "N-P_LOSRMJ_QXKC",
    "N-P_MCCB_RFYD0W",
    "N-C_HNVBBPEOB3G_C01"
  ],
  "facts_path": "../facts/Am8j1Zw5KrE_70-100_facts.json"
}
